{
  "version": 1,
  "job_id": "job-t36-mesh-auto-two-node-live2-20260910",
  "host": "macstudio",
  "action": "exec_write",
  "args": {
    "argv": ["python3", "scripts/mesh_client.py", "--url", "https://mac-studio.taildc96f0.ts.net:8444", "run", "--worker", "auto", "--prompt", "Return exactly MULTINODE_OK"],
    "cwd": "/Users/macstudio/remote-worker-test",
    "timeout_seconds": 120
  },
  "expires_at_unix": 1789085000
}
