{"version":1,"job_id":"job-ab-rollout-20260911-1546","host":"macbook","action":"exec_write","args":{"argv":["python3","-c","import pathlib,subprocess; h=pathlib.Path.home(); r=h/'codex-t30-broker-test'; sha='31e238bb88523477868a43aec5ba73fac4349c56'; subprocess.run(['git','-C',str(r),'fetch','origin','feat/ab-products-20260911'],check=True,capture_output=True,timeout=60); code=subprocess.check_output(['git','-C',str(r),'show',sha+':scripts/ab_fleet_deploy.py'],timeout=20); folder=h/'.local/share/chatgpt-cost-router/ab/bootstrap'; folder.mkdir(parents=True,exist_ok=True,mode=448); script=folder/(sha+'.py'); script.write_bytes(code); script.chmod(384); subprocess.run(['python3',str(script),'--repo',str(r),'--revision',sha,'--gateway-config',str(h/'.config/chatgpt-cost-router/fleet-operator.json'),'--hosts','macbook,macstudio,macstudioprod,sparky'],check=True,timeout=850)"],"timeout_seconds":900},"expires_at_unix":1789145164}
