{
  "version": 1,
  "job_id": "job-ab-source-export-20260911-0520",
  "host": "macbook",
  "action": "exec_write",
  "args": {
    "argv": ["python3", "-c", "import subprocess,gzip,base64,hashlib,json; repo='/Users/loic/codex-t30-broker-test'; sha='6a5b72c490b319f04d90c97ecd47dcb331ce19bd'; subprocess.run(['git','-C',repo,'fetch','--quiet','origin','main'],check=True,timeout=60); raw=subprocess.check_output(['git','-C',repo,'archive','--format=tar',sha],timeout=30); data=gzip.compress(raw,mtime=0); print(json.dumps({'commit':sha,'sha256':hashlib.sha256(data).hexdigest(),'archive_b64':base64.b64encode(data).decode()}))"],
    "timeout_seconds": 120
  },
  "expires_at_unix": 1789107554
}
