{"version":1,"job_id":"job-ab-deploy-inspect-20260911-1534","host":"macbook","action":"exec_write","args":{"argv":["python3","-c","import subprocess,json,pathlib,plistlib,sys; h=pathlib.Path.home(); r=h/'codex-t30-broker-test'; out={'python':sys.executable,'version':sys.version,'repo_exists':r.is_dir()}; run=lambda a:subprocess.run(a,capture_output=True,text=True,timeout=20); p=run(['git','-C',str(r),'status','--porcelain']); out['checkout_status']=p.stdout[:2000]; out['checkout_head']=run(['git','-C',str(r),'rev-parse','HEAD']).stdout.strip(); cfg=h/'.config/chatgpt-cost-router/fleet-operator.json'; out['gateway_config']=str(cfg); out['config_exists']=cfg.is_file(); d=json.loads(cfg.read_text()) if cfg.is_file() else {}; out['gateway_policy']={k:v for k,v in d.items() if k in ['default_timeout_seconds','max_timeout_seconds','max_output_bytes']}; out['hosts']={k:{kk:vv for kk,vv in v.items() if kk in ['enabled','transport','allowed_roots','read_commands','write_commands','runtime']} for k,v in d.get('hosts',{}).items()}; out['services']=[]; la=h/'Library/LaunchAgents';\nfor f in sorted(la.glob('*.plist')):\n if any(s in f.name.lower() for s in ['fleet','mesh','codex','chatgpt']):\n  try:\n   x=plistlib.loads(f.read_bytes()); out['services'].append({'path':str(f),'label':x.get('Label'),'argv':x.get('ProgramArguments'),'keep_alive':x.get('KeepAlive')})\n  except Exception as e: out['services'].append({'path':str(f),'error':type(e).__name__})\nprint(json.dumps(out))"],"timeout_seconds":60},"expires_at_unix":1789142703}
