{
  "version": 1,
  "job_id": "job-t36-sparky-codex-exec-help-20260910",
  "host": "sparky",
  "action": "exec_read",
  "args": {
    "argv": ["/home/baconnier/.nvm/versions/node/v20.20.0/bin/node", "/home/baconnier/.nvm/versions/node/v20.20.0/lib/node_modules/@openai/codex/bin/codex.js", "exec", "--help"],
    "timeout_seconds": 20
  },
  "expires_at_unix": 1789085000
}
