{
  "version": 1,
  "job_id": "job-t36-macstudio-codex-bins-20260910",
  "host": "macstudio",
  "action": "exec_read",
  "args": {
    "argv": ["ls", "-l", "/opt/homebrew/bin/codex", "/usr/local/bin/codex", "/Users/macstudio/.local/bin/codex"],
    "timeout_seconds": 20
  },
  "expires_at_unix": 1789085000
}
