{
  "version": 1,
  "job_id": "job-t36-macstudioprod-find-codex-20260910",
  "host": "macstudioprod",
  "action": "exec_read",
  "args": {
    "argv": ["find", "/Users/macstudioprod/.nvm", "-path", "*/@openai/codex/bin/codex.js", "-print"],
    "timeout_seconds": 30
  },
  "expires_at_unix": 1789085000
}
