{"version":1,"job_id":"job-ab-deploy-inspect-20260911-1538","host":"macbook","action":"exec_write","args":{"argv":["python3","-c","import subprocess,json,pathlib,plistlib,sys; h=pathlib.Path.home(); r=h/'codex-t30-broker-test'; run=lambda a:subprocess.run(a,capture_output=True,text=True,timeout=20); cfg=h/'.config/chatgpt-cost-router/fleet-operator.json'; d=json.loads(cfg.read_text()); out={'python':sys.executable,'version':sys.version,'checkout_status':run(['git','-C',str(r),'status','--porcelain']).stdout[:2000],'checkout_head':run(['git','-C',str(r),'rev-parse','HEAD']).stdout.strip(),'gateway_config':str(cfg),'gateway_policy':{k:v for k,v in d.items() if k in ['default_timeout_seconds','max_timeout_seconds','max_output_bytes']},'hosts':{k:{kk:vv for kk,vv in v.items() if kk in ['enabled','transport','allowed_roots','read_commands','write_commands','runtime']} for k,v in d.get('hosts',{}).items()}}; out['services']=[{'path':str(f),'label':x.get('Label'),'argv':x.get('ProgramArguments'),'keep_alive':x.get('KeepAlive')} for f in sorted((h/'Library/LaunchAgents').glob('*.plist')) if any(s in f.name.lower() for s in ['fleet','mesh','codex','chatgpt']) for x in [plistlib.loads(f.read_bytes())]]; print(json.dumps(out))"],"timeout_seconds":60},"expires_at_unix":1789143603}
