{"version":1,"job_id":"job-ab-deploy-source-20260911-1534","host":"macbook","action":"exec_write","args":{"argv":["python3","-c","import subprocess,gzip,base64,hashlib,json,pathlib; repo=str(pathlib.Path.home()/'codex-t30-broker-test'); sha='d0ba6a97db198a11f19bc8f35ac7b70fab400c69'; subprocess.run(['git','-C',repo,'fetch','origin','feat/ab-products-20260911'],check=True,capture_output=True,timeout=45); paths=['cost_router','fleet_operator','chat_ops','operation_contracts','tests','examples','schemas','policy','scripts','skills','.agents','.chatgpt','requirements.txt','requirements-dev.txt','requirements-fleet-operator.txt','.gitignore','SPEC.md','README.md','docs','pyproject.toml','setup.py','MANIFEST.in','.github']; raw=subprocess.check_output(['git','-C',repo,'archive','--format=tar',sha]+paths,timeout=30); data=gzip.compress(raw,mtime=0); assert len(data)<180000,'export exceeds bound'; print(json.dumps({'commit':sha,'sha256':hashlib.sha256(data).hexdigest(),'archive_b64':base64.b64encode(data).decode()}))"],"timeout_seconds":120},"expires_at_unix":1789142703}
