{
  "version": 1,
  "job_id": "job-fleet-macbook-tests-20260910-2132",
  "host": "macbook",
  "action": "exec_read",
  "args": {
    "argv": ["python3", "-m", "unittest", "discover", "-s", "tests", "-p", "test_fleet_operator*.py", "-v"],
    "cwd": "/Users/loic/codex-t30-broker-test",
    "timeout_seconds": 120
  },
  "expires_at_unix": 1789100000
}
