{
  "version": 1,
  "job_id": "job-t36-sparky-restart-remote-20260910",
  "host": "sparky",
  "action": "exec_write",
  "args": {
    "argv": ["bash", "-lc", "export PATH=/home/baconnier/.nvm/versions/node/v20.20.0/bin:$PATH; cd /home/baconnier/chatgpt-cost-router; bash scripts/stop_remote_worker.sh; export COST_ROUTER_ALLOWED_TAILSCALE_USERS=\"$(tailscale status --json | python3 -c 'import json,sys; d=json.load(sys.stdin); uid=str(d[\"Self\"][\"UserID\"]); print(d[\"User\"][uid][\"LoginName\"])')\"; export COST_ROUTER_REMOTE_WORKERS=openai-A; bash scripts/start_remote_worker.sh"],
    "timeout_seconds": 60
  },
  "expires_at_unix": 1789085000
}
