{
  "version": 1,
  "job_id": "job-t36-sparky-codex-auth-20260910",
  "host": "sparky",
  "action": "exec_read",
  "args": {
    "argv": ["/home/baconnier/.nvm/versions/node/v20.20.0/bin/node", "/home/baconnier/.nvm/versions/node/v20.20.0/lib/node_modules/@openai/codex/bin/codex.js", "login", "status"],
    "timeout_seconds": 30
  },
  "expires_at_unix": 1789085000
}
