{"version":1,"job_id":"job-ab-gateway-activate-20260911-1613","host":"macbook","action":"exec_write","args":{"argv":["/Users/loic/.local/share/chatgpt-cost-router/ab/venvs/10b3ee3e438d57b210b1155e2dbaf19aac9b00db/bin/python","/Users/loic/.local/share/chatgpt-cost-router/ab/source/10b3ee3e438d57b210b1155e2dbaf19aac9b00db/scripts/ab_gateway_activate.py","--rollout","/Users/loic/.local/share/chatgpt-cost-router/ab/rollout.json","--legacy-config","/Users/loic/.config/chatgpt-cost-router/fleet-operator.json","--repo","/Users/loic/codex-t30-broker-test"],"timeout_seconds":240},"expires_at_unix":1789146901}
